{
  "schema_version": "2.0",
  "project_id": "NINEL",
  "scope": {
    "story_boundary": "The research ship medical bay.",
    "scales": [
      "local"
    ],
    "excluded_or_unknown": []
  },
  "locations": [
    {
      "location_id": "NINEL-LO001",
      "name": "Medical bay",
      "scale": "Roadside",
      "story_function": "Contains Ninel\u2019s awakening.",
      "material_conditions": [
        "Emergency light, chamber glass and black monitor."
      ],
      "access_constraints": [
        "No exit is shown."
      ],
      "canon_status": "proposal",
      "provenance": "proposed",
      "basis": "Adapted from the checked-in legacy Ninel scene brief; not independent creative approval."
    }
  ],
  "factions": [],
  "institutions": [],
  "history": [],
  "cultures": [],
  "systems": [],
  "rules": [
    {
      "rule_id": "NINEL-WR001",
      "name": "Unconfirmed reflection",
      "system_type": "technology",
      "statement": "The monitor clears before Ninel confirms the anomalous reflection.",
      "cost": "Uncertainty persists.",
      "limit": "No explanation is established.",
      "contradiction_checks": [
        {
          "scenario": "A later image explains the reflection.",
          "expected_behavior": "Keep it unconfirmed in this demonstration.",
          "resolution": "Request creative review before explaining it."
        }
      ],
      "provenance": "proposed",
      "canon_status": "proposal",
      "basis": "Demonstration interpretation of the checked-in Ninel scene brief.",
      "story_consequence": "Ninel asks Argo about her return."
    }
  ],
  "terminology": [],
  "production_assets": [],
  "assumptions": [
    "No new world canon is established by this integration example."
  ],
  "uncertainties": []
}
